{
    "format": "application/opf-projected-input-cameras+json",
    "version": "1.0",
    "sensors": [
        {
            "id": 21845677,
            "rig_translation": {
                "values": [
                    -0.015,
                    0.015,
                    0.0
                ],
                "sigmas": [
                    0.001,
                    0.001,
                    0.001
                ]
            }
        },
        {
            "id": 65728243,
            "rig_translation": {
                "values": [
                    0.0,
                    0.0,
                    0.0
                ],
                "sigmas": [
                    0.001,
                    0.001,
                    0.001
                ]
            }
        }
    ],
    "captures": [
        {
            "id": 94334,
            "geolocation": {
                "position": [
                    382.20304,
                    3.292843,
                    2.238429
                ],
                "sigmas": [
                    1.69,
                    1.69,
                    2.4
                ]
            },
            "orientation": {
                "angles_deg": [
                    3.3432,
                    -5.2849554,
                    9.345113
                ],
                "sigmas_deg": [
                    0.0134,
                    0.08482,
                    0.016747
                ]
            }
        },
        {
            "id": 78291034,
            "geolocation": {
                "position": [
                    45.3949,
                    10.38429,
                    6.3892923
                ],
                "sigmas": [
                    1.69,
                    1.69,
                    2.4
                ]
            },
            "orientation": {
                "angles_deg": [
                    2.23443,
                    -5.2849554,
                    5.54335
                ],
                "sigmas_deg": [
                    0.0134,
                    0.08482,
                    0.016747
                ]
            }
        },
        {
            "id": 92840,
            "geolocation": {
                "position": [
                    12.19394,
                    22.2048393,
                    11.193748
                ],
                "sigmas": [
                    1.28947,
                    1.2331,
                    2.1923
                ]
            },
            "orientation": {
                "angles_deg": [
                    -6.392785,
                    3.28575,
                    13.27483
                ],
                "sigmas_deg": [
                    0.0134,
                    0.08482,
                    0.016747
                ]
            }
        }
    ]
}
